image_name,caption
2431832075_00aa1a4457.jpg,"""This girl is playing on an object which is yellow , green , red , and blue ."""
2432038587_5e4148e277.jpg,Dog runs after two geese in field
2432061076_0955d52854.jpg,The large brown and white dog splashes on the shore .
2432709509_2a4d0c833f.jpg,The young child is sitting on the grass in a park .
2433175169_da939372f2.jpg,The man is standing on a stone stump on top of a hill with his arms outstretched .
2434006663_207a284cec.jpg,Two dogs running through sand .
2434074318_e35a567220.jpg,A man with a hat stands next to a pyramid-shaped monument on a cliff .
2435166927_28b8130660.jpg,A young girl raises her arms over her head in front of a couple of other people in the park .
2435685480_a79d42e564.jpg,The lady is sitting on a rock .
2436081047_bca044c1d3.jpg,The young girl in the pink shirt and blue jeans is jumping off the tire swing .
2436160351_108924a65b.jpg,Two young children with red dots are their foreheads are both wearing yellow shirts and red shorts and one is riding a red tricycle .
2436398074_8737f40869.jpg,The dog tries to bite the water coming out of the sprinkler .
2437266971_b91a8f9a00.jpg,Man in business attire with Guy Fawkes mask holding paper at protest .
2438085746_588dce8724.jpg,A small black and white dog jumping on the grass to catch a Frisbee
2439031566_2e0c0d3550.jpg,Two people ride together on a black motorcycle .
2439154641_bbf985aa57.jpg,A man wearing a gray shirt jumps through the air with mountains in the background .
2439384468_58934deab6.jpg,"""Two large black dogs , one with a ball in its mouth , are running through tall grass ."""
2439813616_c9ac54cc9f.jpg,Skateboard rider balancing on a rock on his skateboard .
2441313372_6a1d59582b.jpg,A young boy with a cast on his arm is lying on a hospital bed .
2441354291_b32e00e5a6.jpg,The little boy is jumping into a puddle on the street .
2441629086_52f68eb316.jpg,A small girl in a pink shirt and blue jeans is peeping through a window into a house .
2441815792_43565b1312.jpg,A woman stands on a concrete block taking a picture of a group of people on a sidewalk beside the road .
2442243868_abe8f74fb4.jpg,A tan dog wearing a blue collar is playing with an orange toy .
2443229844_277cded27d.jpg,A young boy is playing in the yard .
2443380641_7b38d18f5b.jpg,Boy in yellow shirt getting ready to hit orange ball with baseball bat
2443512473_6f5a22eb42.jpg,A dog weaving through an obstacle course .
244368383_e90b6b2f20.jpg,Many people standing around listening to music .
244399048_8332bb3270.jpg,The furry brown and white dog is jumping around near a door .
2444134813_20895c640c.jpg,The dogs jump over an obstacle at an event .
2444339090_bf7b3211f4.jpg,The white dog is running through white posts on an obstacle course .
244443352_d7636e1253.jpg,A yellow dog with a red bandanna fallen through the crust of the snow .
2444741900_5cb3ef3e1d.jpg,Some people hanging out in the snow .
2444821454_22a346c996.jpg,A dog jumping for a Frisbee in a field .
2444935470_7b0226b756.jpg,The little boy poses in the garden .
2445283938_ff477c7952.jpg,The young girls sat in a circle on the wood floor .
2445442929_8c81d42460.jpg,A man sitting at a picnic table with a tray and partially consumed beer in front of him .
2445654384_4ee3e486e1.jpg,a person helping a small baby down a blue slide
244571201_0339d8e8d1.jpg,Several people and dogs are in or near a large outdoor swimming pool .
2445783904_e6c38a3a3d.jpg,The large brown dog with the red collar is in the grass .
2446315531_7c9704eec0.jpg,Two tan colored dogs playing .
2446601467_a35841cb1d.jpg,A small child is standing in his blue and aqua playpen and all you see if from his eyes up .
2447035752_415f4bb152.jpg,There are people in swimming pool next to a river .
2447284966_d6bbdb4b6e.jpg,The boy wearing a black shirt and blue jeans is holding a red baseball bat .
2447289477_e888df561d.jpg,Woman sitting alone with drink on a bench as people walk by .
244760289_f4467b2b67.jpg,Three people on a beach .
244760301_5809214866.jpg,Several hikers walking along a rocky path .
244774022_a12c07afdb.jpg,Man riding a surfboard on a wave .
2447972568_1e9b287691.jpg,A man with a close-cropped haircut is waiting to catch a child that he has thrown into the air .
2448210587_9fe7ea5f42.jpg,There is an older white haired lady and a bulldog sitting on a tree stump .
2448270671_5e0e391a80.jpg,The dog with big ears is leaping over a fallen tree .
2448393373_80c011d301.jpg,A young boy wearing blue is holding a blue baseball bat and holding a white ball in his hand .
244867897_d00369a779.jpg,Two medium sized light brown dogs are playing tug of war with a dish cloth .
244870123_dcb6e53643.jpg,Two large black dogs with red studded collars pulling on ends of a white rag on porch
2448793019_5881c025f9.jpg,Distorted photograph of a child at the bottom of a slide .
244910130_e1f823a28a.jpg,An unshaven man sits in front of an evergreen tree .
244910177_7c4ec3f65b.jpg,Women walking down the street .
2449289139_08fc1092c1.jpg,The dog runs in the park .
2449446913_28fa5b7c75.jpg,Twelve members of a baseball team walk across the diamond .
2449518585_113dc4a8e5.jpg,The young girl is on a swing outdoors .
2449552677_ee78f01bae.jpg,The handicapped man wheels past the parking lot .
2450299735_62c095f40e.jpg,Little girl slides down in the pool .
2450453051_f1d4a78ab4.jpg,Man in white shirt tossing Frisbee for black and white dog who has a white Frisbee in its mouth .
2450486758_a66fd296ea.jpg,Man and jumping dog perform Frisbee act for crowd at outdoor event .
2451114871_8617ae2f16.jpg,Greyhounds racing chasing a mechanical rabbit around the track .
2451285022_59255e7fd9.jpg,The man wearing a tan hat and white shirt holds his brown dog which is wearing an orange collar .
2451988767_244bff98d1.jpg,two kids playing super heroes
2452238877_2340609c6e.jpg,Brown dog jumping off of a deck .
2452334314_a7c443a787.jpg,White horse with jockey jumps a barrier
245252561_4f20f1c89e.jpg,Two dogs are playing together on the pavement .
2452686995_621878f561.jpg,Two people travel down a path going though a woods with a giant waterfall .
2453318633_550228acd4.jpg,A tan and black dog leaps through a burning hoop on a field .
2453891449_fedb277908.jpg,Two dogs running through a yard with a forest in the distance .
2453971388_76616b6a82.jpg,Two young girls run through a pool while water sprays them .
2453990033_df53f0d8c8.jpg,The girl in the bright red outfit is skipping across the path .
245442617_407eba1e98.jpg,The woman is holding up the line with the fish that she caught in the lake with her bamboo fishing pole .
2455286250_fb6a66175a.jpg,A girl in a sports outfit balances a soccer ball on her head .
2455528149_6c3477fd33.jpg,Some people are looking at pictures at an art gallery .
2456030728_d3d147e774.jpg,Young asian girl with blue hair ribbon picking nose .
2456615908_59cdac6605.jpg,The black dog is jumping over a fence with a bird in its mouth .
2456907314_49bc4591c4.jpg,A man standing on a boat is pulling another boat close by with a bamboo stick .
2457052334_b5a1d99048.jpg,Man helps another person reach the top of a rock they are climbing .
2458006588_754c4aa09c.jpg,A dog on a girder with a river bank in the background .
2458033289_f0616879df.jpg,The man with a white beard and blue cap is standing in the doorway of a workshop .
2458269558_277012780d.jpg,Young child swinging on a swing .
2458862292_466a920ee2.jpg,The man in the blue is posing for a picture next to his car .
245895500_a4eb97af02.jpg,The man is standing in the river next to smoking grass .
2460126267_0deea8b645.jpg,A young boy wearing an orange uniform stands on the field near a colorful ball .
2460134050_06de9f5c4a.jpg,The dog is running while looking up
2460159430_71ab1aacfa.jpg,Two dogs running through tall grass .
246041128_bedb09ed74.jpg,A woman with thick curly blond hair sits outdoors at a table .
2460477085_088e25f857.jpg,Three males are jumping on a trampoline outside .
246055693_ccb69ac5c6.jpg,A yellow dog jumping off of a porch .
2460797929_66446c13db.jpg,The boys in life jackets smile and laugh while riding in a boat .
2460799229_ce45a1d940.jpg,Three boys wearing yellow lifevests on a raft on the water .
2460823604_7f6f786b1c.jpg,The boy in the green and yellow shirt has a glove on and is going towards the ball .
246094557_e174a5914f.jpg,Little girl throwing food in the air for her white dog to catch .
2461372011_ebbf513766.jpg,The hiker is walking up a snow covered hill with a black dog .
2461616306_3ee7ac1b4b.jpg,The young boy is jumping into the pool on his belly .
2461631708_decc5b8c87.jpg,Young boys in orange life vests sit on a raft .
2461990494_c5ece064cc.jpg,the man is wearing a backpack and sunglasses while walking through an outdoor market .
2462153092_e3f4d8f6a2.jpg,Girl running through a field with a brown dog and a white dog .
246231741_882b45c4e1.jpg,Two German Sheppard dogs are fighting .
2462702522_1b25654762.jpg,toddler dressed in blue and red holding blue and red ball
2463067409_78188c584c.jpg,The grey dog is jumping through the grass with water in the background .
2464259416_238ef13a2e.jpg,Two dogs looks at each other while standing on the dirt .
246508774_1e9885f1b7.jpg,There is a woman in a pink shirt holding a can and three other men .
2465218087_fca77998c6.jpg,Person standing in the water by a yellow boat with an oar in their hand .
2465441099_a1761a1757.jpg,Young people hang out at a party .
2465497494_43d74df57c.jpg,A young child in a blue shirt is playing with sand
2465691083_894fc48af6.jpg,Black and tan dog swimming toward shore of pond
2466093839_33bbc8cbd9.jpg,Two young kids play and run .
2466171100_5e60cfcc11.jpg,Two dogs play in the grass .
2466171114_3fa51415a7.jpg,The brown dog with the white chest is carrying a ball .
2466420387_86fe77c966.jpg,Two women are looking into a glass case .
2466495935_623b144183.jpg,Young boys playing soccer .
2467803152_70eeca1334.jpg,"""Two dogs are running , one of them has a stick in its mouth ."""
2467821766_0510c9a2d1.jpg,People walking in a line with backpacks are using a trail through the trees .
2467850190_07a74d89b7.jpg,The backs of a woman and a dog .
2467853482_17009933e8.jpg,A young boy wearing a blue shirt blows bubbles .
2467856402_0490413d38.jpg,A little girl with blonde hair and a blue shirt is blowing bubbles outside with someone .
246901891_4c4ea49c3a.jpg,Man walking fast with coffee in hand down the sidewalk .
2469351714_d72becd21e.jpg,The little girl jumps up into the air with the sand beneath her .
2469498117_b4543e1460.jpg,muxzzled greyhound leaping in race with yellow jacket .
2469620360_6c620c6f35.jpg,Woman standing in a field of tulips
2470486377_c3a39ccb7b.jpg,Two boys talk on a field near palm trees .
2470493181_2efbbf17bd.jpg,Two young boys playing a game on a log while other kids look on .
2470519275_65725fd38d.jpg,A boy playing in mud
2470588201_955132a946.jpg,The boy is playing with a colorful ribbon .
247097023_e656d5854d.jpg,"""A man wearing a black shirt is standing on top of a rock that says , """" life is short """" ."""
2471297228_b784ff61a2.jpg,two young girls htting each other with sacks on a field .
2471447879_6554cefb16.jpg,A young girl practicing rock climbing on an indoor wall .
2471493912_2d4746b834.jpg,Two girls wake through some mud at a park .
2471974379_a4a4d2b389.jpg,People on motorcycles ride down a street with an American flag waving .
2472250097_a3191a94b3.jpg,A silhouette of a man with a fishing pole .
2472574160_8ce233f396.jpg,The man is in a field of tulips .
2472634822_7d5d2858c0.jpg,A young Asian boy running with a white and grey dog on green grass .
2472678549_67068a1566.jpg,A little boy is in a bathroom holding a green ball .
2472720629_d9a6736356.jpg,Man and boy fly kite in park .
2472896179_245e7d142f.jpg,man holding harness waterskiing
2472980433_210ec62874.jpg,The motorcycle is being ridden on a track whilst pulling a wheelie .
2473293833_78820d2eaa.jpg,Young boy wearing a denim shirt sticks out his tongue .
2473689180_e9d8fd656a.jpg,person on a wakeboard in the air
2473737724_355599a263.jpg,Two girls karate fighting
2473738924_eca928d12f.jpg,Two young girls sparring in white martial arts outfits while a third person watches from the side .
2473791980_805c819bd4.jpg,A waterskier cuts through the blue water with sailboats in the background .
2474047296_fd9179d438.jpg,Elderly man sitting in a doorway .
2474092890_6c0781a8ed.jpg,The person is holding a picture in front of their face .
2474918824_88660c7757.jpg,A man wearing a brown sweatshirt helps a man in red climb a rock .
2475162978_2c51048dca.jpg,A woman with a softball runs after a child in a grassy lawn .
2475300106_b8563111ba.jpg,The yellow dog is running next to a bush on a path in the grass .
247617035_9f2e821534.jpg,The man in the brown jacket is sitting on the ground by the jetty .
247617754_4b1137de8c.jpg,"""Woman sitting and looking at phone , with a black backpack ."""
247618600_239eeac405.jpg,A young woman with a purple cloth hiding her face relaxes on a wooden deck .
247619370_a01fb21dd3.jpg,Woman in a black shirt sitting on a red bench .
2476214153_99a3998509.jpg,Little boy kicking pink soccer ball on a basketball court .
247637795_fdf26a03cf.jpg,A woman wearing a scarf stands near the water and looks down .
247652942_29ede19352.jpg,Kite flying high in the sky with sky rider .
247691240_3881777ab8.jpg,There is a man in a light shirt climbing a rocky cliff .
247704641_d883902277.jpg,The dog walks across the stream on a fallen log .
247706586_7e25c7adf8.jpg,A man sits underneath a large and colorful rock formation .
2477121456_1ac5c6d3e4.jpg,The black dog 's head is poking up out of the water .
2477623312_58e8e8c8af.jpg,The little blond haired girl in a grey sweatshirt dances at a park with people seated behind her .
247778426_fd59734130.jpg,The dog is swimming .
2478929971_9eb6c074b6.jpg,The six kids are in the shade of a leafy green tree .
2479162876_a5ce3306af.jpg,Dog in desert area with distant man in background .
2479180530_7ebba2d8bf.jpg,The dog is playing with the stick on the beach .
2479553749_f7ac031940.jpg,Small child looking at a colorful children 's amuseument ride .
2479652566_8f9fac8af5.jpg,A young girl wearing red sunglasses sits near a sink and holds the faucet .
2480021389_dda9fb2818.jpg,Climber scaling rock at night .
2480327661_fb69829f57.jpg,The young child is standing in a martial arts pose .
2480664591_e6d22ed61c.jpg,Two people row a boat .
2480668859_6f9b46be6a.jpg,Many people ride in a canoe near a forest .
2480820830_bdec1f5b76.jpg,Two dogs are running around in the water .
2480832276_fa55480ecb.jpg,The boy in the red shirt climbs a large rock .
2480850054_de3433b54a.jpg,A teenage boy runs through the dirt near a house in the country .
2481003841_06086eafc2.jpg,Two young boys with playground equipment
2481367956_8577d2fa98.jpg,"""Small boy reaching for blue bar in play area , another child in background ."""
2481490320_7978c76271.jpg,A person rowing in their boat in the water .
2481598514_05a65d1f72.jpg,Two children riding tricycles are passing a pink banner .
248174959_2522871152.jpg,A woman in a red shirt is sitting on the edge of a high cliff .
2482629385_f370b290d1.jpg,A large brown dog leans into the water from the grassy shore .
2483792149_a9b4ffecec.jpg,"""The blonde woman is crouching in a field of pink tulips , near a grassy field and trees ."""
2483993772_f64e9e4724.jpg,The German shepherd dog is trying to catch a blue ball .
2483993827_243894a4f9.jpg,"""White , black , and brown greyhounds racing in numbered shirts ."""
2484190118_e89363c465.jpg,Small child in white shirt and print shorts with hands over their head standing on object .
2485467050_1d5e2696d4.jpg,Two boys and two girls jump as they have their photo taken .
2486364531_b482d7f521.jpg,Young boy bouncing off a trampoline .
248646530_03c6284759.jpg,Young child jumping in the air .
248858242_1c33c54ada.jpg,A small dog stops in its tracks to look at the big dog chasing it .
2488795251_c108c77b13.jpg,Three young girls wearing white dresses smile at the camera .
2489602993_896c1ea40a.jpg,The number 52 motorcyclist in a blue and black helmet is going around a corner .
248994078_a9257f448b.jpg,The dog tries to bite a big blue ball .
2490179961_e842fda5eb.jpg,"""Two little girls , one with chocolate on her face , make faces ."""
2490365757_b869282cb3.jpg,A photographer eyes his next subject in a garden of tulips .
2490687446_9d46fdf5a9.jpg,Black dog in the water shaking the water off of him .
2490768374_45d94fc658.jpg,The little girl is wearing a white T-shirt with a peace sign and a sea foam green tutu .
2490863987_715383944a.jpg,The man is asking for money .
2491343114_a3e35a2a3a.jpg,The dog is running through the wet sand .
2492258999_5764124bba.jpg,Two people are sitting against a building near shopping carts .
2493469969_11b6190615.jpg,Brown dog looks mean while running
249394748_2e4acfbbb5.jpg,Two white dogs run through the grass .
2493974889_50ae29f1e1.jpg,Two kids are walking on a path in the woods .
2495394666_2ef6c37519.jpg,The brown dog is swimming in the water .
2495931537_9b8d4474b6.jpg,"""There is a dog laying on the floor and another standing over him , licking his ear ."""
2496236371_61dec88113.jpg,The red motorcycle pulls a wheelie on the racetrack .
2496370758_a3fbc49837.jpg,Two thin dogs are running fast through tall dry grass .
2496399593_a24954a5ca.jpg,Young brunette woman smiling in front of bushes .
2497074804_b4f3e7fd90.jpg,Man with white shirt and green shorts poses for a picture .
2497420371_74788d7ba1.jpg,"""A man outside at a red brick building with a grocery cart , a bike , and miscellaneous ."""
2497608431_8dfefc7a1a.jpg,The man in the black jacket is throwing a stick for the dog to chase .
2498897831_0bbb5d5b51.jpg,Three young girls pose together outside .
2500354186_0836309cc9.jpg,A young boy is carrying tire rubber down a dirty road .
2500567791_101d5ddee3.jpg,Dog chasing brown cow and black cow
2500826039_165e75b20c.jpg,The couple embrace on the street .
2501595799_6316001e89.jpg,A young boy wearing a red swimsuit jumps into a blue kiddie pool .
2501742763_b2cb322087.jpg,"""A black dog runs and , focusing on something ."""
2501942587_e59b91d1da.jpg,Several people are in a front of a colorful painted building .
2501968935_02f2cd8079.jpg,"""There is a man in a purple shirt , leather chaps and a red bandanna , standing near other men ."""
2502007071_82a8c639cf.jpg,"""Three adults and one child are waiting outside of a building , perhaps a school ."""
2502079538_10ef2e976b.jpg,Two people stand by a camel with containers strapped to him .
2502354602_f4d6dcf42d.jpg,A man in a black suit knocks his head with his fist as he puts his arm around a woman in a white strapless dress .
2502782508_2c8211cd6b.jpg,A man wearing a camouflage hat and sunglasses reading a book on a black metal bench .
2502835694_4fe121bbea.jpg,Several people are gathered on the steps in front of a brick building .
2502856739_490db7a657.jpg,Three dogs at the park .
2502905671_c6039804ab.jpg,Man on rocky beach playing with black and white dog .
2502935765_a0ae1fa7be.jpg,A little boy sits and spins on a playground .
2503629305_055e9ec4b1.jpg,A yellow dog runs through the grass .
2504056718_25ded44ecb.jpg,The dog jumps up to catch the Frisbee .
250406927_a5028a31d4.jpg,A dog plays with a soccer ball .
2504277798_936a09c74d.jpg,Girl in pink shirt fires at the target at a firing range .
2504764590_cf017c2a6e.jpg,Someone is at the water 's edge with two dogs .
2504991916_dc61e59e49.jpg,Two people walk toward a potato chip truck .
2505056124_1276e8dbcb.jpg,Boy flying a distant kite .
2505360288_c972bd29c4.jpg,A wiener dog bites at bubbles made by a bubble blowing machine .
2505465055_f1e6cf9b76.jpg,The light colored dog is running through a field .
2505988632_9541f15583.jpg,A small girl with brown hair and a big smile is jumping rope .
2506892928_7e79bec613.jpg,Three kids palying with a toy cat in a garden .
2507182524_7e83c6de82.jpg,The dog is running after a ball and stirring up dust .
2507312812_768b53b023.jpg,Two dogs are running on the beach along the water .
2508249781_36e9282423.jpg,"""The woman wearing a dress and hat , sits on the steps , with her head on her hands ."""
2508313118_524e93d48c.jpg,The brown dog is leaping to catch a Frisbee .
2508918369_2659db1cb6.jpg,Two smiling boys with goggles on play in an inflatable swimming pool with water up to their waists .
250892549_1e06a06a78.jpg,Two tan dogs play with a blue toy in a green field of grass .
2509824208_247aca3ea3.jpg,A brown dog runs through the grass .
2510020918_b2ca0fb2aa.jpg,Boy crawling through a cement tunnel .
2510029990_7014f907cb.jpg,The boy is sliding down a metal slide .
2510197716_fddca0ac75.jpg,A young girl wearing a pink hat swinging on a swing set .
2510560080_1439fe32f2.jpg,Two young girls are riding horses within a white fence .
251056963_c8b67f0107.jpg,A dog walks across a tall ladder .
2511019188_ca71775f2d.jpg,Two dogs are playing ; one is catching a Frisbee .
2511762757_bd0ab0a017.jpg,Dog running and jumping high bars .
2512682478_b67cc525c7.jpg,One young boy pushing another young boy on a swing .
2512683710_991c9d466d.jpg,The old looking ship is sailing at sunset
2512876666_9da03f9589.jpg,The dog is standing on top of the rocks next to a man taking a photograph .
2513260012_03d33305cf.jpg,Two dogs running through a low lying body of water .
2514581496_8f4102377e.jpg,White dog with orange bows on ears leaps to reach kitchen counter .
2514612680_b0d2d77099.jpg,"""People walking through a short tunnel with """" Where are you ? """" written on the wall ."""
2515247156_c1b759fc33.jpg,"""Little boy coming at camera down blue slide , smiling woman in background ."""
251586160_a31b187a37.jpg,Black dog running while man looks on .
2516317118_10ae66b87a.jpg,"""Toddler in pajamas plays with paper cutouts of the letter """" P """" ."""
2517082705_93bc9f73ec.jpg,The boy wearing the blue shirt is running on the grass between the trees .
2517284816_9b8fd3c6b6.jpg,Middle school aged kids are showing their school spirit at a pep ralley .
251792066_b5233b3d86.jpg,There is a black dog catching a green toy in its mouth .
2518094853_dfce24ce8c.jpg,Large dog running in the field .
2518219912_f47214aa16.jpg,The little girl is holding a yellow hose for a brown dog .
2518508760_68d8df7365.jpg,A race dog is running for first
2518853257_02f30e282e.jpg,Two women on green chairs are looking at a book .
2519483556_2b1632a18c.jpg,Three pre-teen girls wearing sunglasses dance and sing in a family home .
251958970_fa6b423f23.jpg,"""Man with tan cap , suit jacket and plaid shirt behind a picture in an outdoor scene with other people in the background ."""
2519594430_551225e5bd.jpg,The dog is walking with a toy .
2519812011_f85c3b5cb5.jpg,Some children run through a fountain .
2520255786_b70a3ec032.jpg,A child jumps off of a swing while it is in motion .
2520909293_9bb7f7364e.jpg,Man holding onto bike handlebars while in midair .
2521062020_f8b983e4b2.jpg,A young boy is getting harnessed and ready to climb a manmade rock wall .
2521213787_ca9b5a1758.jpg,"""Bright blue car going down a dirt road , as onlookers watch ."""
252124738_796599e94b.jpg,A woman in yellow sitting next to a man with a cob of corn .
2521770311_3086ca90de.jpg,a young boy with a samll cardboard box atop his head .
2521878609_146143708e.jpg,kid eating pasta
2521938720_911ac092f7.jpg,The cricket player just misses catching the ball .
2521938802_853224f378.jpg,The baseball player holds up his bat ready to swing .
2521983429_33218366bd.jpg,Man and dog standing on rocks next to water
2522230304_1581d52961.jpg,A man with a dark brown shirt is climbing up a rocky elevation .
2522297487_57edf117f7.jpg,A woman holds a baby while another child looks on .
2522467011_cc825d89ac.jpg,The small girl in the red skirt played with the hula hoops .
2522540026_6ee8ab4c6a.jpg,Silver and blue car marked 104 raises dust on road as two background people watch .
2522809984_2e8a7df4fb.jpg,The drenched dog is swimming .
2524003134_580e74328b.jpg,A dog swims through the water .
2524084967_a5e011b73d.jpg,The man is performing a trick off a ramp with a bicycle .
252504549_135b0db5a3.jpg,Small dog catching a ball in its mouth on a beach .
2525232298_cf42d415ab.jpg,This picture depicts looking up at a rock climber .
2525270674_4ab536e7ec.jpg,The brown and white dog is catching a Frisbee in his mouth .
2525455265_f84ba72bd7.jpg,A young woman sits on a bench .
2525666287_638ab5e784.jpg,Two people wait on a bench .
2525716531_e6dedee421.jpg,A man with a quilted glove is bitten by a dog .
252578659_9e404b6430.jpg,Three sheep graze on the grassy field with a dog walking behind them .
2526041608_a9775ab8d7.jpg,Two young football players wearing blue and yellow uniforms fight for the ball .
2526585002_10987a63f3.jpg,two men huddle around a dog .
2527163162_d0fb802992.jpg,A young girl dressed in a uniform is holding a very long stick .
2527303359_6c3dc3f282.jpg,A woman in a white dress walks toward the water on a beach with white boots in the foreground .
2527713011_b0ec25aa54.jpg,The race car is speeding up the hill .
252802010_3d47bee500.jpg,Two small dogs run across the green grass .
252846811_7b250935a7.jpg,Two yellow dogs play-fighting .
2528489543_546c1ca81f.jpg,One blue and one green water slide .
2528521798_fb689eba8d.jpg,A white rally car is throwing mud into the air as it approaches a bend in the track .
2528547068_7d37479b9b.jpg,A red rally car taking a slippery turn in a race .
2528552898_9e49a7033f.jpg,"""A yellow race car in a curve , with smoke behind it ."""
2529116152_4331dabf50.jpg,This black man appears to be break dancing on the pavement .
2529205842_bdcb49d65b.jpg,"""Two men in uniforms playing basketball , struggle for the ball ."""
2531531628_b4a5041680.jpg,The little girl is sitting on an old bench and making a face
