image_name,caption
3030294889_78b2ccbe51.jpg,Three whales are jumping in the air while people watch .
3030566410_393c36a6c5.jpg,A woman slides down a purple water slide with a small boy on her lap into a pool .
3030793171_55cd646eed.jpg,Brown dog running on grass .
3030823649_3b7b6c728d.jpg,The German shepherd dog is chasing after a ball .
3030824089_e5a840265e.jpg,A German shepherd jumps left on patchy grass .
3030962048_f71948226c.jpg,Old woman missing teeth stands with metal object in hand .
3031263767_2e3856130e.jpg,Lady carrying her child in the river .
3032790880_d216197d55.jpg,two soccer players kick a soccer ball .
3033210806_3ffc0a231a.jpg,The elderly person enjoys sitting on the deck on cold but sunny day .
3033257301_e2c8a39b04.jpg,three women wearing bright colored dresses hold hands .
3033612929_764d977bd5.jpg,Two dogs walking with their toys .
3033668641_5905f73990.jpg,Bearded man rock climbing .
3033686219_452b172ab0.jpg,A brown dog sits on the beach .
3033741581_136889ac73.jpg,A young boy plays in the water of a shallow swimming pool .
3033825101_44a4390f16.jpg,"""The guy is in a baseball uniform , in a baseball field , and is throwing a baseball"""
3034585889_388d6ffcc0.jpg,Bike rider is looking at a accident of other sports bike rider .
3035118753_69287079dc.jpg,the little boy sitting next to the girl is covering his face with his hand .
3035785330_2fd5e32bb1.jpg,a young boy playing on another mans back
3035949542_cb249790f5.jpg,Two soccer players chasing a ball in the grass .
3036033157_522a43a550.jpg,Black and white dog has blue ball in mouth .
303607405_f36edf16c6.jpg,A wet dog shaking its self dry .
3036382555_30b7312cf3.jpg,two small girls walk along the leaves .
3036596725_541bbe0955.jpg,A white racing dog with a muzzle is racing around the turn of a dirt track .
3036641436_d6594fc45f.jpg,"""Two girls swing on with a boy , all three are wearing blue shirts of the same shade and blue jeans ."""
3036971334_78187a9570.jpg,Three people on a rocky cliff over a body of water .
3037558954_20115165e3.jpg,A wind-surfer in near the beach .
303795791_98ebc1d19a.jpg,two spotted dogs are running through a field
3038045802_93f2cd5fbc.jpg,A snowboarder jumps off a large ramp in the mountains .
3038760935_9a713510eb.jpg,Two small white and brown dogs bound in unison .
3038941104_17ee91fc03.jpg,The skateboarder does a jump near a traffic cone .
3039209547_81cc93fbec.jpg,A man with a dark blue jacket and brown pants stands beside another man in front of a building .
3039214579_43ef79f931.jpg,a man wearing a yellow bike helmet walking his yellow bike along a sidewalk
3039675864_0b7961844d.jpg,two woman eating at a table with a lot of pigeons on the street next to them
3040033126_9f4b88261b.jpg,The dog is leaping into the water .
3040051410_6205682ba3.jpg,An older man gives a woman an amused look .
3040575300_0e4328d205.jpg,Two surfers perform tricks in the waves .
3041170372_c4376cd497.jpg,Man riding a mountain bike doing a jump in the air .
3041348852_872c027c16.jpg,Several dogs in muzzles are racing on the grass .
3041384194_04316bd416.jpg,Woman with short red hair stands alone with a worried look on her face .
3041487045_b48ac7ed08.jpg,A yellow dog is trotting through the leaves .
3041645937_ff7591d134.jpg,Middle-aged man in casual clothes looking off camera .
3041689520_c481bdb20e.jpg,Three naked little boys are playing in a river and are covered in mud ; one is standing up .
3042173467_14394234da.jpg,Two women wearing bare-back dresses look over their shoulder for a picture .
3042380610_c5ea61eef8.jpg,Six people standing behind electrical equipment .
3042381160_ffe2b16808.jpg,Several people standing around and operating computer equipment
3042405316_ba3a01926b.jpg,A young girl is diving into a pile of brown leaves in the yard .
3042483842_beb23828b9.jpg,A smiling man wearing glasses and a leather jacket .
3042484940_0975a5e486.jpg,Two men taking a picture together with the phone of one of the men
3042488474_0d2ec81eb8.jpg,"""Two men , with sunglasses on their heads , talking ."""
3042679440_010b2c596c.jpg,Many people are walking on a busy street at night .
3043266735_904dda6ded.jpg,A woman in a white hat reading a book .
3043501068_be58ac47e1.jpg,The motocross rider does a trick in the air .
3043685748_130db75e3b.jpg,Numbered motorcycles round the turn on a racetrack with billboards in the background .
3043904009_3b5e0412cd.jpg,Two men stand inside an enclosed area with multiple computers present .
3043908909_bb54d2c08e.jpg,Lecture takes place in casual atmosphere .
304408047_98bab3ea64.jpg,Two dogs playing with a small blue ball in a grassy field .
3044359043_627488ddf0.jpg,The furry black and white dog is running through a shallow pool .
3044500219_778f9f2b71.jpg,Four women in dresses pose together .
3044536048_e615466e7f.jpg,"""A person on a surfboard in the waves , holding onto a tether ."""
3044745642_1d0784ff29.jpg,Two people in a tent near a rock wall .
3044746136_8b89da5f40.jpg,A man is giving a presentation in front of a lot of people .
3045613316_4e88862836.jpg,Three men stand on a mountain looking at another .
3046190891_05c6ecd9b6.jpg,The surfer makes a reentry move on a wave .
3046259614_614394e024.jpg,The children are sitting with their shoes off .
3046286572_d2050ab0d9.jpg,The man is doing a trick on a bike in midair .
3046429283_08de594901.jpg,Man in leather motorcycle gear .
3046430047_d7b10123d0.jpg,Three people wearing dark costumes and make-up pose for a picture .
3046431231_dc48851062.jpg,Three women wearing wigs .
3046916429_8e2570b613.jpg,the woman is making faces at the baby that she is holding .
3046949818_245b05f507.jpg,"""Two players from different teams fighting for the white , red , and black ball ."""
3047144646_2252ff8e04.jpg,Five women and three dogs posing for a picture .
3047264032_14393ecea8.jpg,A yellow shirted man wearing a golden sun mask .
3047264346_e24601bfbf.jpg,Two individuals dressed up like animals are posing for the camera .
3047749814_621ed0786b.jpg,A woman waves as she rides a zip line .
3047751696_78c2efe5e6.jpg,A woman wearing a gray t-shirt holds a child wearing a black shirt under a light blue smock .
3048211972_db71d104c2.jpg,A tan dog is climbing down a pile of concrete rubble .
3048380686_732db55281.jpg,The goalie with the white jersey allowed a goal by the player on the red team .
3048461682_e89f81b1c7.jpg,A white dog running in the fallen leaves .
3048597471_5697538daf.jpg,"""Brown dog in water , with orange and blue ball in mouth ."""
3048821353_83d4c0cbb9.jpg,One man is helping another man with red shorts do a back flip in the yard .
3049649128_d83d847168.jpg,The child is playing in the leaves .
3049770416_0fb1954315.jpg,A signer standing in green light .
3050114829_18bc5a6d7c.jpg,Water splashing up against something .
3050264832_4215f2b398.jpg,Snowboarder is standing on his board while the crowd watches him .
3050606344_af711c726c.jpg,A man kiyaking in rough water .
3050650135_23f9d9d2f8.jpg,"""Two men in blue jersey tops and white shorts play soccer ,"""
3050976633_9c25cf6fa0.jpg,These people are playing a soccer type game .
3051125715_db76cebd1e.jpg,Waves crashing against rocks with seagulls flying over .
3051341320_1d0166e775.jpg,There are a lot of people on the roller coaster .
3051384385_c5c850c1f8.jpg,The young boy is pretend playing with boxes .
3051754615_3d6494c2ae.jpg,Rowers racing furiously .
305199420_89f6ddd778.jpg,Two pilots walk along carrying a young girl with a bandaged head .
3051998298_38da5746fa.jpg,People are diving into a swimming pool .
3052038928_9f53aa2084.jpg,Three men are setting up a scene by measuring the lights for a couple sitting on a low couch .
3052104757_d1cf646935.jpg,A monster truck soars into the air at an arena .
3052196390_c59dd24ca8.jpg,Several girls in swimsuits are playing in a sprinkler fountain .
3053415073_5b667230ed.jpg,The skier is wearing a yellow jumpsuit and sliding across a yellow rail .
3053743109_a2d780c0d2.jpg,Black and yellow teams are trying to get the basketball in the goal .
3053785363_50392f2c53.jpg,The field hockey team is trying to score a goal .
3053813297_7ce5f87710.jpg,Some people in a park with a dog and folding chairs .
3053916979_848d32261b.jpg,Many people are fencing on a basketball court .
3054200086_657d4398e8.jpg,Two men playing hockey on the ice .
3054989420_3e755ca352.jpg,Two children throw dead leaves into the air around them .
3054997030_797096dd12.jpg,young boy leaps from a platform at a fenced in playgroud
3055716848_b253324afc.jpg,The skateboarder prepares to wipeout .
3056530884_27766059bc.jpg,Two young girls laughing on a tire swing .
3056569684_c264c88d00.jpg,Wrecked ambulance is being towed by a large truck .
3057497487_57ecc60ff1.jpg,The plane is hanging from the ceiling in the museum .
305749904_54a612fd1a.jpg,The man is wearing a blue shirt .
3057618932_3b80ae85de.jpg,Cyclist biking down a concrete stairway .
3057770908_3fd97f79f9.jpg,Young girl hanging on a vine .
3057862887_135c61816a.jpg,Tribal woman and child staring at each other in the jungle .
3058439373_9276a4702a.jpg,Group of people standing in the town square looking up .
3058627443_1d57ff0a2c.jpg,A person wearing a red shirt is falling off a white surfboard .
3060519665_4d6b9a51b2.jpg,Three kids stand around a red apparatus on two tires .
3060594966_030658d318.jpg,A young boy dressed in a suite concentrates on his footwork with a peace sign in the air .
3060969260_08f43e4f4f.jpg,"""Two people with bicycles , one in front running with a bike and one in back riding ."""
3061481868_d1e00b1f2e.jpg,Two people riding a motorcycle .
3062173277_bfb5ef4c45.jpg,Several people are rowing a boat while being cheered on by a person with a drum
3062273350_fd66106f21.jpg,Seven older gentlemen walking together in a group outside .
306315650_e064f5c677.jpg,There is an open ' Abarrotes Mexico ' store with a man standing in front of it .
306318683_5f1f875191.jpg,a young man wearing a red Pokemon shirt carrying a small red box
3063544435_10516c6937.jpg,Very blue water with skyscraper buildings on the shore and a group of people in a canoes with paddles .
3064097919_e536ab9693.jpg,Young man doing a trick jump on a skateboard .
3064383768_f6838f57da.jpg,The man turns with the wave on his surfboard .
3064716525_b8418d4946.jpg,A dog leaping over a hurdle .
3065468339_4955e90fd3.jpg,This hound is searching the water for his prey .
3065560742_f6e266ccd9.jpg,Two hockey players slide into each other on the ice
3066338314_2c3fb731d1.jpg,The man sitting at the table is posing for a picture .
3066429707_842e50b8f7.jpg,the girl in blue kicks the soccer ball .
3066491113_86569e15be.jpg,"""Two dogs , one carrying a large dish in its mouth ."""
3067500667_0fce8f28d4.jpg,A player hits the ball at a cricket game .
3067885047_f69d90c35b.jpg,Four kids doing backstand in a yard covered with dry leaves .
3067971348_69af5bb309.jpg,The city at night .
3068407619_5207b26986.jpg,a young man parasailing in the ocean .
3068735836_872fba3068.jpg,A motorcyclist is about to fall over .
3068945309_ff0973e859.jpg,Basketball player in white uniform leaping to make a shot while being blocked by player in black .
3068994801_b2bc079e67.jpg,A woman with a purple top and blue pants walks her bike in the shadows .
3069037969_bb7319e0dc.jpg,There is a black and white dog in a sparking blue pool .
3069216757_c419b3898e.jpg,The girl wearing the pink striped shirt is standing in the doorway with her arm outstretched .
3069282021_e05e1829f3.jpg,Six dogs are competing in a race .
3069786374_804e1123ac.jpg,Two men throw a cheerleader into the air and then catch her .
3069937639_364fc11e99.jpg,Small dog running in the field .
3070011270_390e597783.jpg,Dog with black and tan face standing in water looking up at camera .
3070031806_3d587c2a66.jpg,Man watching four dogs play on the beach
3070130228_67dcfee9ae.jpg,Two players in red white and blue football uniforms squat down on the field .
3070274658_fc39fd4f84.jpg,Three older men are sitting around a campfire at night .
3070485870_eab1a75c6f.jpg,Snowboarder does stunt on his board in the snow .
3070713991_8696796937.jpg,A little boy is jumping off a mound of tires in the woods .
3071676551_a65741e372.jpg,A surfer riding a surfboard in rough seas .
3072114570_e1c0127529.jpg,two young children riding on a bike down a dirt road through a puddle .
3072172967_630e9c69d0.jpg,Young men playing basketball in a competition .
3072611047_109bf8b7c3.jpg,Two young boys diving headfirst into water with small waves on it .
3072730593_b7322d2e05.jpg,The woman is wearing a red hat that is decorated with a huge orange feather .
3072782873_3278f3b3a7.jpg,Two people are kissing with old buildings on either side of them and people walking up in the background .
307301755_48919ef1b2.jpg,A man sitting and leaning against a pole holding a small animal .
307321761_606fc91673.jpg,Several young girls stand in a rural road .
307327914_f98f576adb.jpg,An older man with glasses is looking off camera .
3073535022_4af81f360c.jpg,A woman in a yellow shirt is surfing on a white surfboard .
3073579130_7c95d16a7f.jpg,Man with facial hair wearing red and white Palestinian style headscarf .
3074265400_bf9e10621e.jpg,Shows a crowd of people in front of a glass building with three country flags flying high .
3074617663_2f2634081d.jpg,The German Shepherd is digging a large hole in the sand .
3074842262_62b1b2168c.jpg,A young boy standing with a raised leg in a large pile of leaves .
3075068274_2a28a5263b.jpg,The boy safely skates up the ramp before descending again .
3076052114_233f42ae5b.jpg,Two dogs running across a green field with two white animals in the background .
3076928208_5763e9eb8c.jpg,The dog by the fence is running on the grass .
3077166963_fe172c709d.jpg,Woman stands on fallen trees near winding river taking photographs of animals .
3077781040_bc27778609.jpg,Man sits on bike in air .
3078229723_2aa52600de.jpg,Two young boys hold a man 's hands .
3078844565_16e9cdcea2.jpg,The man in the white t-shirt is starting to climb a rock .
3079073247_97e88e2eb7.jpg,Someone riding sideways on a motorcycle .
3079341641_f65f6b0f8b.jpg,Two young girls at play in a home .
3079786914_fe598b0e54.jpg,Two little kids playing in a colapsable fabric tunnel .
3079787482_0757e9d167.jpg,Two young girls hug .
3079917032_3cfacb2fd7.jpg,two Asian women are talking behind an older woman who is wearing a red sweater .
307994435_592f933a6d.jpg,Man in red jacket giving a thumbs-up with one hand a holding ticket in other .
3080056515_3013830309.jpg,Two children standing very close .
308014594_f1d5e75507.jpg,Two women in elaborate Japanese costumes .
3080891382_edf83dde18.jpg,two young children wearing wool caps and mitten covering their mouths while whispering to each other .
3081182021_22cfa18dd4.jpg,A person doing bicycle tricks on a wooden ramp .
3081330705_7a1732e12c.jpg,The man has a blue shirt on and is standing in front of some snowy mountains .
3081363964_d404eccae8.jpg,"""There are two golden retrievers in this picture , but only one is visible and it appears to be smiling ."""
3081734118_6f2090215c.jpg,Gold and white dog catching a tennis ball in its mouth .
3082196097_2d15455b00.jpg,The man with short hair has a microphone in his hand and the other man is playing guitar .
3082474922_9c3533eaf6.jpg,"""Boy wearing red hat , blue jacket pushing plow in snow ."""
3082934678_58534e9d2c.jpg,Two yellow dogs are running side by side down a road .
3083016677_5782bc337c.jpg,Two motorcycles with two riders each .
308307853_5a51fbdecc.jpg,poodle playing on a beach
3084001782_41a848df4e.jpg,Two women and a man are looking at a book .
3084010872_cbc3ea8239.jpg,A woman and man are posing for a picture against a pink wall .
3084011028_d1e2c40d7d.jpg,Two women with long hair posing for a picture
3084011664_76d37c6559.jpg,A woman holding a blue cup and a man with facial hair pose close to one another .
3084018061_df66d98325.jpg,Three men stand in a bar with a purple counter .
3084034954_fe5737197d.jpg,Two women in very colorful costumes stand next to a man dressed in all white .
3084149186_4bc08b0752.jpg,The man wearing a brown shirt clings to a rock .
3084380974_268a0f9236.jpg,A surfer in a wetsuit crests a wave .
3084711346_fda0f5a3e6.jpg,"""Two people wearing handkerchiefs over their faces , one with a blow horn"""
3084731832_8e518e320d.jpg,The white dog trotted in the snow .
308487515_7852928f90.jpg,The bird leans over to a small piece of food .
3085226474_62aba51179.jpg,Women who look alike are performing on a stage .
3085357792_efcf297c71.jpg,Man running down a street in a marathon .
3085667767_66041b202e.jpg,The surfer does a flip off of a wave .
3085667865_fa001816be.jpg,A surfer performs a trick .
3085973779_29f44fbdaa.jpg,Boy wearing a gray sweatshirt playing with a toy airplane .
3086507638_d8a2cd0ac3.jpg,"""Three dogs , two brown and one black , run in the surf ."""
3086523890_fd9394af8b.jpg,two dogs play together .
3086526292_f799d237c7.jpg,You can see the bottom halves of three boys standing on a sidewalk with silly string sprayed everywhere
3086790344_9487c58624.jpg,The girl is swimming is a blue-green ocean .
3086810882_94036f4475.jpg,Dog running across sand .
3087095548_6df7c2a8ed.jpg,Several people are leaning over the side of a bridge looking down into the water .
3087485737_cb09bc80b6.jpg,A young man with a Mohawk style haircut and surfer shorts stands on a boogie board at the beach .
3088074124_481139dc92.jpg,The indian couple mingle at the party .
3088322308_b0c940b3a3.jpg,This family is walking on the beach .
3088399255_1bd9a6aa04.jpg,Seven jockeys riding horses in a race .
3088572348_264c47f78c.jpg,A windsurfer kicks up spray .
3088677667_4a8befb70e.jpg,"""People wearing black , some with face masks , are singing ."""
3088922727_4bdf2ccc94.jpg,A man in a suit and top hat and a woman in a blue Victorian dress sitting outside at a table .
3089107423_81a24eaf18.jpg,The man in the black shirt is pointing his camera at the arena .
308956341_642589e9cc.jpg,A wet dog is shaking off water .
3089742441_d42531c14f.jpg,"""Two people wearing period , winter clothing ."""
3089842255_359ccf5c40.jpg,The long haired child in the pink sweater is jumping up at a punch bag .
3090386315_87ed417814.jpg,The tan dog runs through the leaves .
3090398639_68c0dfa9a5.jpg,Mountain bike riders on a dirt trail .
309049466_1d7e7d5fc2.jpg,The dog retrieves the Frisbee is the snow .
3090593241_93a975fe2b.jpg,"""Large group of people lining up for an event , outdoors at night ."""
3090600019_8808fe7a9d.jpg,"""There is a woman in a sexy cop 's uniform and a guy dressed as a prisoner , standing outdoors ."""
3090957866_f1b2b7f214.jpg,Person walking down the street in the city .
3091177347_58c85c1c3b.jpg,Two people are setting up a photo shoot of a mobile in a white room .
3091338773_9cf10467b4.jpg,A short-haired brown dog is snapping at a long green strip .
3091382602_60b9b53ed1.jpg,Two smiling young men look at the camera .
3091580843_178042c50b.jpg,A man walks on the sidewalk by a sign .
3091594712_2166604334.jpg,Young girl in blue dress and tiara applying makeup in the mirror .
3091912922_0d6ebc8f6a.jpg,The tan colored dog has a yellow toy in its mouth .
3091916691_b1c96669c6.jpg,"""Two men shaking hands and smiling at the camera , while a third man stands behind them ."""
3091921457_83eee69591.jpg,Several children are standing in a house looking out the window .
3091962081_194f2f3bd4.jpg,The man is dressed in black and smiling while another man is drinking and an elderly woman is standing near a fence .
3092200805_dd1f83ddbe.jpg,two people in canoes ride through the water .
3092370204_029b6bc10a.jpg,Two women among a group of people in a bow-like stance .
309238565_2d5d8dc8bf.jpg,Two kids and a man play games at an arcade .
3092756650_557c5f2d03.jpg,Several men wearing ethnic hats are watching the photographer in an outdoor market .
3093970461_825b0cac2f.jpg,Two young women are hugging each other and leaning on a stone wall at the beach .
3093971101_543237971d.jpg,Surfer in wetsuit riding before a wave
3094064787_aed1666fc9.jpg,Two speckled dogs running on a grassy field .
3094278545_febac56382.jpg,a woman wear a fancy dress and tiara on a beach
309430053_cc58bcc36a.jpg,Someone is swimming in the ocean near an unmanned rowboat .
3094317837_b31cbf969e.jpg,A surfer on a red surfboard jumps over a high wave in the ocean .
3094568845_d0b56c5651.jpg,Smoke comes from car in professional race
3095137758_bdd1e613dd.jpg,Santa is pulled in a carriage in a parade .
3095225232_2e6e6dc92e.jpg,Several people ride up an escalator .
3096163135_584901a5ae.jpg,A person wearing a red hat shaped like hands sits in a crowd .
309687244_4bdf3b591f.jpg,The back of a man climbing a rock .
3096918227_f9d26a7db2.jpg,Skateboarder in midair at a park .
3097171315_0ba7d283b1.jpg,"""The people are gathered in a room with a sofa , round mirror , and chandelier ."""
3097196395_ec06075389.jpg,Two racing dogs run around a track .
309771854_952aabe3cc.jpg,Two religious men glancing off to their right while standing in front of a church .
3097776588_312932e438.jpg,Two smiling men with their heads touching
3098336319_a7e5b061d0.jpg,In the snow a person on a board traverses down a concrete wall beside bleachers .
3098707588_5096d20397.jpg,Two men in suits laugh and hold drinks .
3098714492_19939e3b19.jpg,Men in suits are lined up next to a bride and her red-dressed bridesmaids .
3098824948_23c31df031.jpg,The man is walking the bride down the aisle .
3099091086_f75f0ce09d.jpg,"""Protesters with """" NO NEW COAL """" signs in urban area ."""
3099264059_21653e2536.jpg,The snowboarder is doing a stunt high in the air at night .
3099504809_565e17e49d.jpg,There is an oriental man climbing up a mountain .
3099694681_19a72c8bdc.jpg,"""Musicians sitting at a table inside , playing classical instruments ."""
3099923914_fd450f6d51.jpg,Two people are sitting at an outdoor cafe in front of an old building .
3099965396_2a0018cb9e.jpg,A woman is waiting alone outside while a bird walks behind her .
3100251515_c68027cc22.jpg,Group of people walking with posters .
3100442775_6e2659b973.jpg,A person on a bmx bike .
3101378069_f8caa14c0a.jpg,Person in pointed hat and face covered with green scarf poling boatload of stuff through water
3101796900_59c15e0edc.jpg,Two dogs are chasing a ball .
310213587_778fe8fb5b.jpg,A man is standing next to a bench drinking a soda while other people sit on a bench nearby .
3102204862_f1d220230b.jpg,Two people are in a wrestling match .
3102363657_dc95fe6850.jpg,"""Small boy hugged by person in bee costume , blurry urban background ."""
310260324_7f941814bc.jpg,Several men in front of a white building .
3103185190_eb8729c166.jpg,Girl jumping into the air on top of a rock in front of a canyon .
3103231330_db98b14501.jpg,The man in the blue jacket is walking in a crowd of people past an English pub .
3103264875_2a8d534abc.jpg,White dog with orange collar walks in the field .
3103340819_46de7954a9.jpg,"""Young , hooded boy and girl huddle on steps outside large doors ."""
3103587323_7f093d5b90.jpg,a young girl pulling the tail of an alligator staue
3104182973_5bb1c31275.jpg,People walking by an outdoor ice rink with a tree in the center .
3104400277_1524e4f758.jpg,Two people on motorbikes .
3104690333_4314d979de.jpg,Two young children play in the snow .
3104909823_0f41dd8be6.jpg,Two men stand outdoors in the city night .
3105315670_5f86f73753.jpg,"""The woman is wearing a brown hat and black coat , and is on a sidewalk ."""
3105623068_392b767a7b.jpg,The girl is climbing an artificial climbing wall .
3105691757_817083b0a6.jpg,Men in Santa outfits walking down busy street .
3105929913_94a6882e25.jpg,Two bald men and two bald women dressed in all white standing in a prayer pose .
3106026005_473a7b1c8c.jpg,Man sitting on a bench on the sidewalk .
3106223494_52d4d2d75d.jpg,Guy in Santa suit wearing ninja mask and horns
3106340185_80d0cb770a.jpg,The man is with a camera looking out of an open window
3106562372_e349a27764.jpg,Two little girls jump above the floor .
3106782647_b078830a9e.jpg,The teen jumps the hill with his bicycle .
3106787167_e5f2312622.jpg,Two muddy men try to tackle third muddy rugby player .
3106791484_13e18c33d8.jpg,Little blonde boy is falling onto a bed .
3106857210_07a92577fc.jpg,a young blond woman wearing a yellow shirt walking down a sidewalk .
3106883334_419f3fb16f.jpg,Two dogs run over the grass .
3107059919_0594269f72.jpg,A young girl running on the beach .
310715139_7f05468042.jpg,Dog on a rock next to water .
310728631_155c3bbeea.jpg,Flock of pigeons flying in front of building with a mural painted on it .
3107368071_724613fc4f.jpg,an audience of children are smiling and pointing
3107463441_7c68606450.jpg,two people build together .
3107513635_fe8a21f148.jpg,Several people waiting outside a train station .
3107558821_f3b205d4ed.jpg,Two young girls look out to a town below them .
3107592525_0bcd00777e.jpg,The man and woman are wearing a protective plastic raincoat .
3107889179_106d223345.jpg,Various members of a family are gathering around a decorated dining table .
3108197858_441ff38565.jpg,Some children are raising their hands and clapping .
3108378861_d2214d971e.jpg,A woman standing next to a man who is sitting on a rock .
3108544687_c7115823f5.jpg,A man and woman wearing sunglasses sitting on a rock .
3108732084_565b423162.jpg,Two snowboarders in a snowy scene .
3109124656_626b596d5e.jpg,A man and woman pose on a couch .
3109136206_f7d201b368.jpg,A dog putting his legs into a pond
3109268897_d43797fc6a.jpg,Old man with a black coat and hat .
3109688427_d2e702456c.jpg,The two girls and their dad are looking in at the path .
3109704348_c6416244ce.jpg,Three men play ball in a field .
3109780402_dbae082dc5.jpg,Two young women sitting against a concrete wall .
3110018626_307a123b59.jpg,Two large dogs frolic in a grassy field .
3110174991_a4b05f8a46.jpg,Two men talk and laugh .
