image_name,caption
3499720588_c32590108e.jpg,The man plays his guitar on the local streets .
3500115252_9404c066a8.jpg,The dog plays with a purple toy near a cat .
3500136982_bf7a85531e.jpg,Rollerbladers roll in formation down a hill .
3500139659_b2a60b0141.jpg,Two motorcyclists lay over to the side as they make a sharp curve .
3500342526_393c739e2f.jpg,Two dogs play in the yellow grass with a ball .
3500399969_f54ce5848f.jpg,Seven people leaping into the air over a walk over blue water .
3500505549_d848209837.jpg,The skateboarder does a trick on the railing while other people passing by watch .
3500829879_a643818d84.jpg,Number 75 motorcycle racer rides his red and black bike .
3501083764_cf592292a6.jpg,Woman in a white and gold shirt holding a baby and with three children and a man in a jacket .
3501206996_477be0f318.jpg,The young boy wearing a brown coat is playing soccer .
3501313414_ae865b6fdf.jpg,The brown and white dog is jumping over a high wire fence .
3501386648_e11e3f3152.jpg,A group of people with cameras and binoculars point and look at something .
350176185_b8c5591e36.jpg,The German shepherd leaps off the stairs .
3501781809_88429e3b83.jpg,Boy jumping over rail on bicycle while crowd watches
3501936223_6122a13d27.jpg,The skier is going down a large mountain .
3502343542_f9b46688e5.jpg,These helmeted people are rock climbing outdoors .
3502459991_fdec2da131.jpg,Someone fires a gun at a indoor shooting range .
3502563726_30d1ce29c8.jpg,Two dogs on leashes get close together .
3502897880_8392d0e4de.jpg,Three skateboarders are in a park .
3502993968_4ee36afb0e.jpg,A man in a yellow shirt riding a blue bicycle moving very fast .
3503011427_a4ee547c77.jpg,The man wearing a white jacket and black pants is walking in front of a white building .
3503471307_464a8f588c.jpg,The boy does a jumps his bike into the air .
3503544012_1771be9d3a.jpg,Four hockey players and a referee on the ice .
3503623999_bbd5dcfb18.jpg,The lady is wearing a bandanna around her face to protect her from dust .
3503624011_733d745d5a.jpg,The woman has her face painted with a red star and is drinking a beer .
3503689049_63212220be.jpg,The smiling black man is wearing a white t-shirt and dark sunglasses .
3504158556_1d410c8ff7.jpg,Three young men lean on the front of a Toyota truck .
3504275465_604ce2ef34.jpg,A white dog with brown marks jumps from the bank into the water .
350443876_c9769f5734.jpg,A person stands on a ladder and a small child climbs at the bottom of the ladder .
3504479370_ff2d89a043.jpg,The police officers in bright yellow jackets watch the crowd .
3504881781_6a842e043b.jpg,Some men try to load what looks like a cannon .
3504940491_94c43792ed.jpg,The young girl enjoys the swing at the carnival .
350529848_9569a3bcbc.jpg,Two dogs play in the surf and one has a red ball .
3505657604_8899161734.jpg,Two girls wearing colorful shirts and shorts standing in a lighted shower stall .
350588129_6aef7b7fe2.jpg,There is a black dog jumping into a swimming pool .
3506096155_13632955e8.jpg,a motorcycle rider is slightly airborne on a motocross circuit
3506216254_04d119cac7.jpg,The scruffy young man smokes a cigarette on a busy street .
3506468593_7e41a6d9f1.jpg,Woman swinging above water while holding a vine .
3506560025_8d0f4f9ac4.jpg,The woman with a camera is looking to the side in a crowded area
3506607642_40037b3fbf.jpg,Two young soccer players race to the goal .
3506869953_802f463178.jpg,This person is bundled up in warm clothing and jumping over a tire half-buried in snow .
3507076266_8b17993fbb.jpg,The man is walking with a draft horse
3507670136_2e5f94accf.jpg,The motorcycle racer in a yellow uniform is in midair .
3508051251_82422717b3.jpg,The old man with the white beard is walking down the street .
3508522093_51f6d77f45.jpg,Young boy in green shirt rolling on a cart into a pile of leaves .
3508637029_89f3bdd3a2.jpg,women playing softball in uniforms .
3508882611_3947c0dbf5.jpg,Trainer runs her dog through training course with green pipe
3509575615_653cbf01fc.jpg,People supporting a cause .
3509611207_7645b1d28d.jpg,"""Three women with headscarfs holding packages , two smiling , one not ."""
3510218982_318f738b76.jpg,An older man in boxing gloves trains .
3510219078_670b6b3157.jpg,Two dogs run in a field .
3510695264_ef460fa6cc.jpg,People in hard hats take pictures of something .
3511062827_cd87871c67.jpg,The black dog is pulling on something purple with its mouth .
3511890331_6163612bb9.jpg,A man wearing blue rides a brown horse along a gravel path .
3512033659_7e8a0c2ffa.jpg,The crowds are huge as the citizens await the opening .
3512033861_a357bb58b6.jpg,Many people have gathered in the street .
3512127856_18a4c7aace.jpg,The young girl enters the room in amazement .
3512791890_eb065b460a.jpg,a young girl and a woman smile for the camera .
3513265399_a32e8cfd18.jpg,A woman slides into home while the catcher tries to block .
3513362553_5fc5779e20.jpg,A girl at bat in a softball game
3514019869_7de4ece2a5.jpg,Dog performing during an outdoor dog show .
3514179514_cbc3371b92.jpg,Two children are playing baseball
3514184232_b336414040.jpg,A woman with long hair is catching a softball in a softball field .
3514188115_f51932ae5d.jpg,The little girl in the blue dress is walking with a man along a railway track .
3514194772_43ba471982.jpg,A panting brown dog walking on the grass .
3514278386_de2343577e.jpg,Two girls playing in a game of softball .
3514297698_0512623955.jpg,A spotted dog stands on his hind legs to catch a ball on the beach .
3515358125_9e1d796244.jpg,A large brown dog runs after a tennis ball in a field .
3515451715_ac5ac04efa.jpg,Two children on swings with a woman pushing them
3515665835_22e6fb1193.jpg,The motocross rider jumps high in the air on his bike .
3515904775_f8acc5909e.jpg,the black dog is running through the water with a red ball in its mouth .
3516267455_ca17cc1323.jpg,A white dog jumps into natural water .
3516285214_59823b341e.jpg,The large wave is crashing down over a surfer .
3516299821_8f0375d221.jpg,A teenager dressed in a baseball uniform attempting to hit a baseball during a game .
3516312179_f520469038.jpg,A woman swings at a softball on a playing field while other players look on .
3516521516_9950340b96.jpg,Two players are on a wet field and one is on the ground .
3516653997_98ec551a67.jpg,Well dressed man surrounded by women in dresses .
3516825206_5750824874.jpg,"""Young man and woman stretch out on stones , packages in foreground ."""
3516935867_78cf63c69c.jpg,A rider and horse jumping a fence outdoors .
3516960094_87fb4889de.jpg,"""Woman competing in the long jump , photographed in midair ."""
3517023411_a8fbd15230.jpg,Man rides on bicycle as other people walk .
3517040752_debec03376.jpg,Two girls are playing softball .
3517056462_483ee5a914.jpg,The girl is in a red jersey and pitching a softball at a game .
3517124784_4b4eb62a7a.jpg,"""A woman in a brown strip is taking a swing with a baseball bat at a yellow ball , whilst another woman is waiting on the sideline ."""
3517127930_5dbddb45f6.jpg,softball player swinging at a pitch
3517362674_0f5296de19.jpg,A young girl is blowing bubbles with an orange bubble wand .
3517466790_17c7753a1a.jpg,Teenagers wearing formal clothes stand in a group outside .
3518118675_5053b3f738.jpg,The man is going down stairs on a unicycle .
3518126579_e70e0cbb2b.jpg,"""Two men walk down a stone stairway , one is riding a unicycle ."""
3518334317_bc40bae18d.jpg,Two people walk under an arch on a city street .
3518443604_6da641f07d.jpg,"""Two people wearing jeans huddle near a wooden door , sheilding their faces from the camera ."""
3518608016_46453d8b18.jpg,A woman plays with her dog outside .
3518675890_2f65e23ff9.jpg,The skinny brown dog is running through the tall green grass .
3518687038_964c523958.jpg,A man wearing white winds up to throw .
3518755601_cebf11e515.jpg,"""Three young women wearing wetsuits on beach , two gesturing at camera ."""
351876121_c7c0221928.jpg,A small cat laying with a large dog
3519155763_045a6a55e2.jpg,dog with open mouth and a toy close by in the air
3519815055_304dc8e8d6.jpg,A youth in red swim trunks jumps into the water from a wooden board .
3519942322_b37d088aae.jpg,The tan dog runs toward the small toy that is laying in the grass .
3520079657_b828d96d50.jpg,"""Seven people are jumping in the air , along the shore ."""
3520199925_ca18d0f41e.jpg,The woman is holding a violin .
3520321387_710ab74cda.jpg,Mother and son grin for the camera
3520617304_e53d37f0af.jpg,"""Two military men practicing a """" take-down """" maneuver ."""
3520869880_2e8b7d7842.jpg,Girl in red skirt jumps on sidewalk in front of jukebox painting
3520922312_e58a6cfd9c.jpg,Two people carrying bags walk together .
3520936130_9e90872560.jpg,Two people sit on a wooden bench and face each other to talk .
3521201948_9049197f20.jpg,Muzzled greyhound dogs running in a pack .
3521374954_37371b49a4.jpg,Two young children are playing with a drum .
3522000960_47415c3890.jpg,"""Surfer partially visible through crashing wave , shore in background ."""
3522025527_c10e6ebd26.jpg,Crowd watching airplane and helicopter in the sky .
3522076584_7c603d2ac5.jpg,A person on a bike flies through the air with the sun flaring through the bike frame .
3522349685_f046f0e250.jpg,Young girl in ponytail pets furry cat
3522749949_fb615cee47.jpg,The player is kicking a soccer ball on the grass field .
3522989916_f20319cc59.jpg,Two dogs playing on grass .
3523471597_87e0bf3b21.jpg,Two people read a sign in front of a museum .
3523474077_16e14bc54c.jpg,The man in a blue shirt is holding a camera near to a boy wearing a backpack .
3523559027_a65619a34b.jpg,The group of people make single file lines on the field .
3523819210_99782628fc.jpg,man is sitting in blue chair next two pieces of wood
352382023_7605223d1c.jpg,Dog retrieving stick in water
3523874798_9ba2fa46e3.jpg,The boy does a skateboard trick .
3523920786_0eb63993fd.jpg,Black dog in a bandanna runs down a dirt road .
3523950181_414978964e.jpg,Three hockey players are engaged in a game .
3523972229_d44e9ff6d7.jpg,The skateboard is falling away from the skateboarder as he attempt a jump .
3524436870_7670df68e8.jpg,The brown dog is chasing and popping bubbles .
3524519277_bd0c3e7382.jpg,Two uniformed law enforcment officers speaking to another male .
3524612244_64f00afec5.jpg,Some men and women drink wine while watching television .
3524914023_4e96edb09f.jpg,Baseball player holding a bat .
3524975665_7bec41578b.jpg,Woman with hat staring in the distance at park with sculpture .
3525403875_7f95e0cbfe.jpg,Two dogs walking through grass with the white one carrying a yellow ball in mouth .
3525417522_7beb617f8b.jpg,the little brown dog runs past another dog on the grass .
3525453732_f74a38f111.jpg,The bird has its wings spread as it flies .
3525841965_7814484515.jpg,Two young girls stand in the dirt road and smile at the camera .
3526018344_450c517a72.jpg,Two white dogs and two brown dogs running through the grass .
3526150930_580908dab6.jpg,A woman with brown hair is sitting with a little girl with short brown hair outside next to some red flowers .
3526431764_056d2c61dc.jpg,Two people are taking pictures while a third is holding a camera .
3526805681_38461c0d5d.jpg,A man with a sign about god stands holding the leash of a dog in a red brick square .
3526897578_3cf77da99b.jpg,The black and white dog is running with a red pail in its mouth .
3527184455_1a9c074ff2.jpg,Two adults and two children sit on a park bench .
3527261343_efa07ea596.jpg,person riding a bike doing a while
3527524436_a54aca78a9.jpg,Person in black shirt and black tutu waterskiing with hands over head and people in the background .
3527590601_38d56abc29.jpg,A person jumping over a hill on a bicycle .
3527682660_c5e9fa644a.jpg,Three people sit in front of a man who is standing in front of a orange wall with art pictures on it .
3527715826_ea5b4e8de4.jpg,A girl wearing pink flip flops and tights is swinging a tennis racket at a tennis ball .
3527926597_45af299eee.jpg,A young boy skateboarding
3528105511_12ff45dc9c.jpg,Motorcross jumper in mid-flight beneath a grey sky .
3528251308_481a28283a.jpg,A skateboarder sliding along the edge of a wooden bench .
3528902357_be2357a906.jpg,A man in a helmet is doing stunts on a bike .
3528966521_2e871ff6a1.jpg,Several people run down a highway with mountains in the background .
3529211822_1dabdb3a9c.jpg,The brown dog eats from a bowl on the wooden table as a black dog jumps off .
3529314899_b4e533bb76.jpg,Two opposing hockey players make a play for the puck with opposing fans and team members watching .
3529721084_4b405baf54.jpg,Two motorcyclists are standing on the side of the road and one is wearing a skull mask .
352981175_16ff5c07e4.jpg,Two people are hiking in the snow .
3530087422_7eb2b2c289.jpg,The boy in the red and white suit is on a skateboard .
3530342993_a4a1f0e516.jpg,A stunt cyclist launches himself into midair over a ramp while other cyclists watch .
3530502404_f8c3a3f61c.jpg,Man in skeleton-printed leather outfit sitting astride a red motorcycle .
3530504007_3272c57e21.jpg,Two men are speaking with another man who is wearing a blue cap and carrying a book .
3530687486_6e6be53602.jpg,The woman is blowing the pods off a flower in a green field .
3530843182_35af2c821c.jpg,A woman in a crochet hat and sunglasses smiles while the man beside her in a plaid short and sunglasses looks behind her .
353180303_6a24179c50.jpg,Costumed woman applying lipstick .
3531811969_49af4c22f0.jpg,The young man is performing a summersault in the air with a bicycle .
3532028205_9ddd7599f8.jpg,Hockey player playing hockey during a game .
3532098999_4e07a0a17e.jpg,Two dogs run through a field .
3532192208_64b069d05d.jpg,"""The man in the t-shirt , with a gold chain around his neck , is in a room with three others people ."""
3532194771_07faf20d76.jpg,Surfer with board marches out to sea on gray day .
3532200762_b28c39d311.jpg,A woman runs along the shore .
3532205154_5674b628ea.jpg,There is a man looking a girls necklace .
3532412342_e0a004b404.jpg,The child is sitting in a large truck tire .
3532539748_795d16ef07.jpg,Smiling man and boy standing in a yard .
3532587748_7e64bb223a.jpg,The boy is doing a handstand on the pavement .
3532593368_be10432e92.jpg,people raise their hands .
3532761259_14026c1e96.jpg,Two women wearing red are smiling at the camera .
3532782283_341f0381a3.jpg,Three young adults gaze at the approaching storm .
3533145793_5d69f72e41.jpg,Several young girls on colorful mats stretching upwards .
3533394378_1513ec90db.jpg,Two people on an amusement park ride .
3533451027_b078e4631b.jpg,The man in the black and white shirt is running with a ball .
3533470072_87a5b595ba.jpg,Twp young ladies give the piece sign with their fingers to the camera .
3533484468_0787830d49.jpg,Guy and girl in jackets while guy listens to mobile device
3533660418_f3a73a257c.jpg,Three Middle Eastern men are sitting on a sidewalk together .
3533775651_9d7e93dacf.jpg,Two people stand outside of a red car in the city and hug .
3533922605_a2b1e276f6.jpg,Two young women are sitting in front of a large window overlooking a big city .
3534046564_4f8546e364.jpg,Two dogs face off of each other on the grass .
3534183988_3763593dfb.jpg,Two men holding cups and one lady holding a cigarette .
3534512991_f9fd66f165.jpg,Couple posing for picture with white and yellow flowers in the background .
3534548254_7bee952a0e.jpg,"""A young girl in a yellow t-shirt is about to throw a wet , yellow sponge ball ."""
3534668485_6887629ff0.jpg,"""Two women talking on cellphones , with posters behind them ."""
3534824784_7133119316.jpg,A woman and daughter are smiling at the camera .
3534952095_975cca0056.jpg,Woman riding a small red and white motorcycle and wearing a matching red helmet and scarf
3535056297_e16f014cb7.jpg,"""Three young men wearing hooded sweatshirts , standing at a bench ."""
3535084928_858544f49a.jpg,There is a dog licking its chops .
3535284878_f90f10236e.jpg,A white dog with a black harness runs on a rocky shore .
3535304540_0247e8cf8c.jpg,A red biplane streaks across the sky leaving a white trail behind it .
3535372414_4c51c86fc4.jpg,The woman is standing in the garden with a young girl .
3535664885_c848c0faee.jpg,The goalie with the blue and white jersey is sliding near the goal posts .
3535768334_a3924bcccd.jpg,Young man does stunt on bicycle near beach .
3535879138_9281dc83d5.jpg,many people walk in the street .
3536561454_e75993d903.jpg,"""Two skateboarders , one wearing a black t-shirt and the other wearing a white t-shirt , race each other ."""
3537201804_ce07aff237.jpg,Two kids sit in the middle of a playground toy that spins around them .
3537218226_478d2e4f26.jpg,Two rock climbers near the base of a rock face .
3537400880_8f410d747d.jpg,Young woman jumping on trampoline .
3537452619_3bd79f24e0.jpg,A teenage boy grinds his skateboard over a red rail .
3537474810_cf676b3259.jpg,Man in blue shirt kicks soccer ball .
3537520829_aab733e16c.jpg,A skateboarder riding a rail .
3537806062_c50d814aba.jpg,Two dogs play together in the yard .
3537920947_6c5a956f47.jpg,The skateboarder is about to jump from a wooden bench .
3538021517_b930dc76fc.jpg,Two kids are playing soccer together .
3538213870_9856a76b2a.jpg,Blonde girl in green dress with pink flowers .
3538527033_df13112d51.jpg,Three women in festive dresses are dancing in a large city street while a large crowd is behind them holding up a banner .
3538686658_30afc75f02.jpg,A person riding a bicycle travels down an overgrown hill .
3539767254_c598b8e6c7.jpg,The gondola is poling his boat in the canal .
3539817989_5353062a39.jpg,The man kneeled down and the cats circled him .
3539840291_1c3eed701d.jpg,Rugby players tackling each other .
3540155303_08225a4567.jpg,Man doing stunt on bike in a skate park .
3540241710_a4f49cde52.jpg,A skateboarder in midair above an indoor ramp .
3540416139_c884f38351.jpg,The brown dog is running outside on the grass .
3540416981_4e74f08cbb.jpg,The white dog is running in the green grass .
3540515072_8c951b738b.jpg,The furry brown dog is jumping on the concrete .
3540598210_972f0ff573.jpg,A young girl wearing a pink floral outfit walks down the sidewalk .
3541141771_67d305c873.jpg,Two young people at park .
3541162969_68fa4a60df.jpg,a woman dives into the water .
3541474181_489f19fae7.jpg,A snowboarder is jumping in the air over a snow slope .
3541483943_9776baee7c.jpg,"""The boy is jumping a skateboard down the steps , surrounded by graffiti covered walls ."""
3541491057_61a49588d9.jpg,Two large dogs run in green grass with water in the background .
3541915243_956c1aa8ef.jpg,two people in a crowd are looking up
3541962817_78bcd3835b.jpg,The horse and rider jump a fence .
3542341321_faa2d2d48a.jpg,"""Two dogs on the grass , barking at each other ."""
3542418447_7c337360d6.jpg,Two dogs run to catch a yellow soccer ball .
3542425197_2ef81c6051.jpg,Two people perform on a stage with electric guitars .
3542484764_77d8920ec9.jpg,The man wearing white clothes and white leg padding is practicing a sport .
3542771548_fcb8fa0cba.jpg,A person aquestrian horse jumping over a wooden fence .
3543294190_0037c59607.jpg,Man in a red shirt riding a trick bicycle on only the rear wheel .
3543378438_47e2712486.jpg,The man in the green jacket is playing the piano next to a woman who is by a music stand .
3543600125_223747ef4c.jpg,People sitting in building having drinks
3544233095_4bca71df1d.jpg,A young boy carries a green bucket on a sandy beach with a cloudy sky overhead .
3544312930_3a0b8d70c1.jpg,The woman in the blue top is holding a pink jacket in her arms
3544483327_830349e7bc.jpg,boy on bike jumping over a sign
3544573946_e03aebbfde.jpg,A young girl posing for a man to take a photograph near a parking lot .
3544669026_1b5c0e6316.jpg,The big black dog is jumping up in the air to catch a ball .
3544673666_ffc7483c96.jpg,The leashed dog jumps high to catch the old soccer ball .
3544793763_b38546a5e8.jpg,Two men battle it out in a boxing match with white gloves .
3544803461_a418ca611e.jpg,Two men boxing in a match .
3545427060_c16a8b7dfd.jpg,Three Indian children playing in water .
3545586120_283d728a97.jpg,Two men with white gloves box in a dimly lit boxing rink .
3545652636_0746537307.jpg,Little boy in red getting ready to kick soccer ball while other boy watches .
3545779287_8f52e06909.jpg,The dog is running with a rope toy .
3545793128_af3af544dc.jpg,Young woman standing above a crowd .
3546027589_253553252a.jpg,The children are talking and playing in the street .
354642192_3b7666a2dd.jpg,A person swims in a pool by a waterfall .
3546474710_903c3c9fd3.jpg,"""The gutarist upfront is under a spotlight , and the drummer in the back is under one too ."""
3546720729_38fff1bbd9.jpg,two men play instruments .
3546891929_f31a99cd0d.jpg,A man with a bicycle helmet on is using a cellphone in the midst of a crowd .
3547000169_40191e02ca.jpg,Three men sitting behind a window ringed with green neon lights .
3547313700_39368b9a2f.jpg,"""Two tan dogs , one larger than the other , interact in a grassy yard enclosed by a wooded fence ."""
3547368652_0d85c665d3.jpg,The boy is skateboarding on the stairs .
3547499166_67fb4af4ea.jpg,Two girls dressed like waitresses dance along with a man dressed as a chef .
3547524138_4157f660b0.jpg,The early stages of a water balloons toss .
3547600292_6f8aac7f2e.jpg,A brown bird is standing still in a grassy field .
3547647914_4dd56a8c1b.jpg,Women and children are playing on a paved road .
3547704737_57d42d5d9d.jpg,A runner winces as he runs .
3548191125_514f47e493.jpg,A young boy in a red uniform jumps on a trampoline .
3549006919_3604bc813e.jpg,A person wearing a yellow helmet is climbing a cliff .
3549011001_26cace3646.jpg,Three men on wooden boat in front of buildings
3549140234_e99b07c739.jpg,The young man is riding a skateboard and performing a trick .
3549277110_24d4064ccd.jpg,Two young boys read comic books in bed .
3549408779_4d453db080.jpg,A small black and white dog paddles in some clear blue water .
3549464203_8ab9c6160b.jpg,The girl is at the park playing on the jungle gym .
3549583146_3e8bb2f7e9.jpg,The boy with the red and blue helmet rides his bicycle .
3549614763_42f34f3d1e.jpg,Two young women sitting at an outdoor resaurant looking at menus about to place their order with the waiter standing at their table .
3549673305_4dfd44e04a.jpg,Man kissing a woman 's neck on a busy sidewalk .
354999632_915ea81e53.jpg,There is something visible through the hole in the wall .
3549997413_01388dece0.jpg,A skier goes down a hill with a mountain as a backdrop .
3550253365_27d4c303cf.jpg,Four people sitting on low cement ledge .
3550255426_4ab03c0d6e.jpg,A woman is jumping over a hurdle on a track in front of a grassy field with people on it .
3550276904_19de3561c5.jpg,A young girl with two fingers in her mouth sitting next to an older woman .
3550459890_161f436c8d.jpg,The man is throwing a toy to a brown and black dog in the park .
35506150_cbdb630f4f.jpg,a man wearing a red jacket sitting on a bench next to various camping items
3550763985_800cfee7e4.jpg,The skateboarder is doing a trick off the side of a half pipe
3551003620_0b02d76f65.jpg,A woman skates while others run on a path .
3551170666_01df31412d.jpg,The momma dog is feeding her litter of pups .
3551281733_b43bf6f870.jpg,The bird that is flying has a very long beak .
3551447084_becc6a4666.jpg,Person riding dirt bike on track while others stand by track
3551787566_b5ebbe2440.jpg,Woman in blue workout attire and helmet rides through dirt path
3552206648_123bf4ac82.jpg,The large white bird swoops down hovering above the water .
3552435734_04da83b905.jpg,The black dog is running through water .
3552796830_2dd2aa9c2c.jpg,Two soldiers are running down a track .
3553056438_4e611a7a2a.jpg,Two children are sitting on hay in front of pumpkins and play witches .
3553225222_f5ebe44af1.jpg,Young girl in red graduation suit flings her hat upward into the field .
3553374585_25b1bd6970.jpg,Three young men in white walking near tented area with banner advertisement .
3553476195_fb3747d7c1.jpg,Two black dogs fighting over an orange toy .
3554210976_fbd0ef33a3.jpg,"""This person , dressed in blue , is standing on a snowy mountain ."""
3554634863_5f6f616639.jpg,The man in the yellow suit stands near musical instruments and a crowd .
3555231025_73fa54fa29.jpg,"""Girl in pink top dancing in a field ,"""
3555573680_41c1540a86.jpg,A man waterskiing through the air near a dock .
3555729342_cc7a3b67fd.jpg,The boy in the gray t-shirt is standing next to the girl in the green dress and cowboy hat on the beach .
3556037801_3992ce6826.jpg,People shopping in a bike shop .
3556390715_65c6d1e88b.jpg,The small dogs runs in the yard .
3556485995_9cd40269e9.jpg,Two men play lacrosse or field hockey .
3556571710_19cee6f5bd.jpg,Three smartly dressed man and woman are standing beside a bicycle on the grass .
3556598205_86c180769d.jpg,A quad sends dirt flying into the air .
3556792157_d09d42bef7.jpg,The kids talking while sitting on a row of chairs along the wall .
3557148230_7fc843e5de.jpg,The small child is standing on a tricycle .
3557295488_600d387347.jpg,Two men attempt to hit a ball on a sports field with their team members standing by .
3557316485_574a5f7a89.jpg,a skateboarder skates in the pool .
3557324238_6ba58831d9.jpg,The person is throwing a yellow object in the air while standing on sand .
3558251719_3af5ae2d02.jpg,The man has a dog on a leash and appears to be teaching it to stand on its hind legs .
3558370311_5734a15890.jpg,The biker does a trick in the air .
3558438174_d8f41438a4.jpg,Two women in black with flags are standing in front of an old-fashioned car .
3558683579_8fb36b55a6.jpg,Three men are playing basketball and one of them blocked the others shot while people play in the back .
3558796959_fc4450be56.jpg,Tennis player running for the ball .
